Quote,Author
Better to know a few things which are good and necessary than many things which are useless and mediocre.,Leo Tolstoy
"The difference between real material poison and intellectual poison is that most material poison is disgusting to the taste, but intellectual poison, which takes the form of cheap newspapers or bad books, can unfortunately sometimes be attractive.",Leo Tolstoy
"One of the worst prejudices known is held by the majority of the so-called scholars of our time, who claim that a person can live without faith.",Leo Tolstoy
"The essential meaning of every religion is to answer the question “Why do I live, and what is my attitude to the limitless world which surrounds me?” There is not a single religion, from the most sophisticated to the most primitive, which does not have as its basis the definition of this attitude of a person to the world.",Leo Tolstoy
The life of a person without faith is the life of an animal.,Leo Tolstoy
"The most important question to keep before ourselves at all times is this: Do we do the right thing? During this short period of time which we call our life, do our acts conform to the will of the force that sent us into the world? Do we do the right thing?",Leo Tolstoy
"When I am in difficult circumstances, I ask God to help me. But it is my duty to serve the Lord, and not His to serve me. As soon as I remember this, my burden becomes lighter.",Leo Tolstoy
"Just imagine that the purpose of your life is your happiness only—then life becomes a cruel and senseless thing. You have to embrace what the wisdom of humanity, your intellect, and your heart tell you: that the meaning of life is to serve the force that sent you into the world. Then life becomes a constant joy.",Leo Tolstoy
"Even if we don’t want to, we can’t help but feel our connection to the rest of mankind: we are connected by industry, by trade, by art, by knowledge, and most importantly, by our common mortality.",Leo Tolstoy
The history of mankind is the movement of humanity toward greater and greater unification.,Leo Tolstoy
"Sometimes, the damage done by our words is obvious and sometimes it isn’t, but the damage is not any smaller for our not being able to see those people who suffer from our words.",Leo Tolstoy
Be afraid to destroy the unity of people by stirring bad feelings amongst them against another with your words.,Leo Tolstoy
"It’s important to strive to do good, and even more important to strive to abstain from evil.",Leo Tolstoy
"No matter how many times yon aim to achieve victory over your passions, do not give tip. Every effort weakens the power of passion and makes it easier to gain victory over it.",Leo Tolstoy
"Kindness is necessary in relationships with people. If you are not kind to a person, you are not fulfilling your major obligation.",Leo Tolstoy
"The kinder and the more thoughtful a person is, the more kindness he can find in other people.",Leo Tolstoy
"Kindness enriches our life; with kindness mysterious things become clear, difficult things become easy, and dull things become cheerful.",Leo Tolstoy
"Christian teaching is so simple that even small children can understand its meaning. Those people cannot understand it, and only those, who want to seem and to be called Christians without being real Christians.",Leo Tolstoy
"Buddha said, “A man who starts to live for his soul is like a man who brings a lantern into a dark house. The darkness disappears at once. You have to be persistent in this, and your soul will have this light.”",Leo Tolstoy
"Christ expressed all His teachings in His last commandment: “Love each other, as I loved you. Everyone will see that you are my disciples, if you love each other.” He did not say, “If you believe,” but “If you love.” Faith can change with time, because our knowledge is constantly changing. Love, on the contrary, never changes; love is eternal.",Leo Tolstoy
My religion is love to all living beings.,Leo Tolstoy
"In order to fulfill Christianity, we have to destroy its perversions and restore its purity.",Leo Tolstoy
"Knowledge is real knowledge only when it is acquired by the efforts of your intellect, not by memory.",Leo Tolstoy
"A thought can advance your life in the right direction only when it answers questions which were asked by your soul. A thought which was first borrowed from someone else and then accepted by your mind and memory does not really much influence your life, and sometimes leads you in the wrong direction.",Leo Tolstoy
"Read less, study less, but think more. Learn, both from your teachers and from the books which you read, only those things which you really need and which you really want to know.",Leo Tolstoy
"The basis of all education is the establishment of our relationship to the beginning of all things, and the conclusions about our behavior which may be drawn from this.",Leo Tolstoy
Religious upbringing is the basis of all education.,Leo Tolstoy
"Perfection is impossible without humility. “Why should I strive for perfection, if I am already good enough?”",Leo Tolstoy
"Remember all the bad things which you have done, and try to avoid doing bad things again. Remembering only your good deeds will interfere with your doing good in the future.",Leo Tolstoy
"There are people who take responsibility for making decisions for others and determining their relationship to God and to the world; and there are people, the overwhelming majority of them, who give this authority to the others, and blindly believe in everything they are told. Both groups of people commit an equal crime.",Leo Tolstoy
"A man should use that spiritual heritage which he has received from the wise and holy people of the past, but he should test everything with his intellect, accepting certain things and rejecting others.",Leo Tolstoy
Every person should define for himself his attitude to this world and to God.,Leo Tolstoy
Faith is the understanding of the meaning of life and the acceptance of those duties and responsibilities connected to it.,Leo Tolstoy
"You should not worry too much about what will happen after death. Deliver yourself to the divine creature and bless it: you know that it is love, therefore, why should you be afraid?",Leo Tolstoy
"When Christ died, he said, “Father! I deliver my spirit into Thy hands.” Those who say these words, not with their tongue but with all their heart, do not need anything else. If my spirit returns back to its Father, this is the best place for it, and nothing can be better.",Leo Tolstoy
Don’t think that you can find peace for your soul without faith.,Leo Tolstoy
"You should love only one thing in yourself, that which is the same in all of us. In loving that which is the same in all of us, you love God.",Leo Tolstoy
People live by love: love of yourself is the beginning of death; love of other people and of God is the beginning of life.,Leo Tolstoy
"Love is not a source, it is a consequence of our understanding the divine, spiritual beginning which exists in all of us.",Leo Tolstoy
The greatest truth of the teachings of Christ is the direct connection between a man (God’s son) and God (His Father).,Leo Tolstoy
Beware of everything which puts an obstacle between you and God.,Leo Tolstoy
False faith is the major cause of most of our misfortunes.,Leo Tolstoy
"The purpose of a human life is to bring the irrational beginning of our life to a rational beginning. In order to succeed in this, two things are important: (1) to see all irrational, unwise things in life and direct your attention to them and study them; (2) to understand the possibility of a rational, wise life. The major purpose of all teachers of mankind was the understanding of the irrational and rational beginnings in our life.",Leo Tolstoy
"Accept the teaching of Christ as it is, clear and simple; then you will see that we live among big lies.",Leo Tolstoy
"Live for your soul, and without trying or even understanding that you’re doing it, you will contribute to the improvement of society.",Leo Tolstoy
"It would be nice if wisdom had such a quality that it could flow from one man who is full of wisdom to another man who has no wisdom, just as with two connected vessels water flows from one vessel to the other until the water level is the same in both of them. The problem is that to obtain wisdom, you must make an independent, serious effort of your own.",Leo Tolstoy
"Improve your own soul, and be confident that only in so doing can you contribute to the improvement of the larger society of which you are part.",Leo Tolstoy
A scholar knows many books; a well-educated person has knowledge and skills; an enlightened person understands the meaning and purpose of his life.,Leo Tolstoy
"There are a limitless number of different sciences, but without one basic science, that is, what is the meaning of life and what is good for the people, all other forms of knowledge and art become idle and harmful entertainment.",Leo Tolstoy
"We live a senseless life, contrary to the understanding of life by the wisest people of all times. This happens because our young generations are educated in the wrong way—they are taught different sciences but they are not taught the meaning of life.",Leo Tolstoy
The only real science is the knowledge of how a person should live his life. And this knowledge is open to everyone.,Leo Tolstoy
Society can be improved only by self-sacrifice.,Leo Tolstoy
"There is only one law, both in your personal and social life: if you want to improve your soul, you should be ready to sacrifice it.",Leo Tolstoy
"The improvement of man can be measured by the level of his inner freedom. The more a person becomes free from his personality, the more freedom he has.",Leo Tolstoy
"Death and birth are two limits, and something similar is hidden behind each.",Leo Tolstoy
"When you think about what will happen to your soul after death, think also about what happened to your soul before your birth. If you plan to go somewhere, then you came from somewhere.",Leo Tolstoy
"Where do we go after death? We go to where we came from. There is nothing which can be called ourselves in that land; therefore, we do not remember what has happened to us there.",Leo Tolstoy
"When a person leads a good life, he is happy at the present moment and he does not think what will happen after this life. If he thinks of death, he looks at how well this life is laid out, and he believes that after death everything will be as good as it is now. It is much better to believe that everything which God makes for us is good than to believe in all the pleasures of paradise.",Leo Tolstoy
A person should not think too much about what will happen after his life. Follow the will of those who sent us into this world; that will is in our minds and our hearts.,Leo Tolstoy
"The more closely a person follows his intellect and controls his passions, the closer he comes to spiritual life, to love of God and of his neighbor.",Leo Tolstoy
"We would think a man insane who, instead of covering his house with a roof and putting windows in his window frames, goes out in stormy weather, and scolds the wind, the rain, and the clouds. But we all do the same when we scold and blame the evil in other people instead of fighting the evil which exists in us. It is possible to get rid of the evil inside of us, as it is possible to make a roof and windows for our house. This is possible. But it is not possible for us to destroy evil in this world, just as we cannot order the weather to change and the clouds to disappear. If, instead of teaching others, we would educate and improve ourselves, then there would be less evil in this world, and all people would live better lives.",Leo Tolstoy
"It seems to us that the most important work in the world is the work which is visible, which we can see: building a house, plowing the land, feeding cattle, gathering fruits; and that the work which is invisible, the work done by our soul, is not important. But our invisible work at the improvement of our soul is the most important work in the world, and all other visible kinds of work are useful only when we do this major work.",Leo Tolstoy
No exceptions or special circumstances can justify the murder of a living person. Murder is the most vulgar violation of the Law of God as it is expressed in all religious teachings and in all people’s conscience.,Leo Tolstoy
"Military service makes people corrupt, because the military, in time of peace, abides in complete idleness; they lack any useful labor, they are freed of the obligations of such work. Instead, they create notions of honor of regiment, or of banner, or the complete subjugation of one person by another.",Leo Tolstoy
"When civilians get into these circumstances, they become ashamed of such a way of life. The military, on the contrary, are proud of it and boast of this way of life, especially during periods of war. They say: “We are ready to risk our lives at war, and therefore such a careless joyful life is necessary for us, and we have the right to lead it.”",Leo Tolstoy
"The same divine beginning lives in all people, and no single person or gathering of people has the right to destroy this connection between the divine beginning and a human body, that is, to take a human life.",Leo Tolstoy
"Among all sins, there is one which completely opposes the major blessing of human life, which is your love for your brother: there is no worse sin than to destroy this major joy of life, by feeling rage and hatred for your brother.",Leo Tolstoy
"Seneca, a wise man from Rome, said that when you want to escape from your rage, when you feel that it grows, the best thing to do is to stop. Do not do anything: do not walk, do not move, do not speak. If your body or your tongue moves at this moment, then your rage will grow.",Leo Tolstoy
"Rage is very harmful for all people, but it is most harmful for the man who experiences it.",Leo Tolstoy
Your rage cannot be justified by anything. The reason for your rage is always inside you.,Leo Tolstoy
"Nobody knows where the human race is going. The highest wisdom, then, is to know whereyoushould go: toward perfection.",Leo Tolstoy
"Your actions should be determined not by the desire of the people around you, but by the needs of all mankind.",Leo Tolstoy
"There is a basic knowledge which is necessary for every human being; until a person has acquired this basic knowledge, all other kinds of knowledge will be harmful for him.",Leo Tolstoy
"It is better to know several basic rules of life than to study many unnecessary sciences. The major rules of life will stop you from evil and show you the good path in life; but the knowledge of many unnecessary sciences may lead you into the temptation of pride, and stop you from understanding the basic rules of life.",Leo Tolstoy
"A rich man cannot be merciful. If he becomes really merciful, he will quickly lose his riches.",Leo Tolstoy
The best example of the cruelty of the rich man’s life is his effort to become virtuous.,Leo Tolstoy
"In order to love not with word and tongue, but in deed and truth, everyone should help those who ask for help, so Christ said.",Leo Tolstoy
"But if you start giving to all those who ask, even if you are very rich, very soon you will not be rich anymore.",Leo Tolstoy
"Love for other people gives a real feeling of good, and it unites you with other people and with God.",Leo Tolstoy
A wise man loves not because he wants to profit from it but because he finds bliss in love itself.,Leo Tolstoy
"They asked a Chinese man, “What is science?” He said, “Science is knowing people.” Then they asked, “And what is virtue?” He answered, “Virtue is loving people.”",Leo Tolstoy
"Just as a mother puts her life at risk to guard and save her only child, so every person should guard and save in himself love for every living being.",Leo Tolstoy
"The fearlessness, calm, inner peace, and joy which are given to us by love are so big that all other things in the world cannot be compared with them, especially for the person who understands the real blessing of love.",Leo Tolstoy
"For a person to know the law that makes him free, he must be elevated from a material to a spiritual life.",Leo Tolstoy
"“I and God are the same,” said the teacher. If you think that my spiritual being is God, you are mistaken. But my real self is close to God, and to other people. In order to understand this part of myself, you should elevate the man inside of you. When you elevate the man inside of you, then you will see that there is no difference between him and any other person on earth.",Leo Tolstoy
"It only seems as if we differ from each other. A flower on a blossoming tree can think that it is a separate being, but all flowers are parts of the same blossoming of one apple tree, and they all come from one seed.",Leo Tolstoy
Submission to the law created by men makes one a slave; obedience to the law created by God makes one free.,Leo Tolstoy
"Wisdom is knowing the purpose of life, and knowing how to achieve it.",Leo Tolstoy
There is nothing in which real wisdom cannot be displayed.,Leo Tolstoy
"When people wanted to kill a bear in the ancient times, they hung a heavy log over a bowl of honey. The bear would push the log away in order to eat the honey. The log would swing back and hit the bear. The bear would become irritated and push the log even harder, and it would return and hit him harder in return. This would continue until the log killed the bear. People behave in the same way when they return evil for the evil they receive from other people. Can’t people be wiser than bears?",Leo Tolstoy
"You should respond with kindness toward evil done to you, and you will destroy in an evil person that pleasure which he derives from evil.",Leo Tolstoy
The true teaching of love is strong; it kills evil before evil can grow and become powerful.,Leo Tolstoy
"Only greatly insolent people establish a religious law which is to be taken for granted by others, which should be accepted by everyone on faith, without any discussion or doubts.",Leo Tolstoy
Why must people do this?,Leo Tolstoy
"The essence of the teaching of Christ is to follow his commandments. Those who just repeat, “My God, My Lord” will not get to heaven; only those who fulfill God’s will.",Leo Tolstoy
It is not possible to explain the origin of the spiritual from the material.,Leo Tolstoy
"The difference between the spiritual realm and the material is equally clear and obvious, both for a child and a wise man; further speculations are not necessary.",Leo Tolstoy
"There are two different states of human existence: first, to live without thinking of death; second, to live with the thought that you approach death with every hour of your life.",Leo Tolstoy
"The more you transform your life from the material to the spiritual domain, the less you become afraid of death. A person who lives a truly spiritual life has no fear of death.",Leo Tolstoy
"When you have doubts about what to do, just imagine that you might die at the end of that same day, and then all your doubts will disappear, and you will see clearly what your conscience tells you, and what is your true personal wish.",Leo Tolstoy
"A man condemned to immediate execution will not think about the growth of his estate, or about achieving glory, or about the victory of one group over another, or about the discovery of a new planet. But one minute before his death a man may wish to console an abused person, or help an old person to stand up, or to put a bandage on someone’s injury, or to repair a toy for a child.",Leo Tolstoy
Kindness is for your soul as health is for your body: you do not notice it when you have it.,Leo Tolstoy
"Love is real only when a person can sacrifice himself for another person. Only when a person forgets himself for the sake of another, and lives for another creature, only this kind of love can be called true love, and only in this love do we see the blessing and reward of life. This is the foundation of the world.",Leo Tolstoy
"Nothing can make our life, or the lives of other people, more beautiful than perpetual kindness.",Leo Tolstoy
"A man is free only when he lives in truth, and the truth may be perceived only by the intellect.",Leo Tolstoy
"We are not free in this world, subdued by our passions and by the emotions of other people to the degree that we forget the requirements of our intellects. If we really want to become free, we can be so only through our intellect.",Leo Tolstoy
"All events, whether in the lives of human individuals, or human societies, have their beginnings in thought. Therefore, to fully understand other people and other societies, we must look beyond previous events to the thoughts which gave rise to them.",Leo Tolstoy
Perhaps it is even more important to know what one should not think about than what one should think about.,Leo Tolstoy
"A thought seems to be free and independent, but a human being has something stronger than thought, something which could guide our thoughts.",Leo Tolstoy
"In order to change the nature of things, either within yourself or in others, one should change, not the events, but those thoughts which created those events.",Leo Tolstoy
"Sexual desire is the most all-consuming of desires. This desire is never sated, for the more it is satisfied, the more it grows.",Leo Tolstoy
"Very often people are made proud by their control over their own desires, and by the force and passion with which they master them. What a strange delusion!",Leo Tolstoy
"Many people worry, and suffer, because they have been involved in so many bad things in their lives. In truth, though, good things often happen in spite of our wishes, and sometimes even in opposition to our wishes, and often after our excitement and suffering over unworthy things.",Leo Tolstoy
Remember how passionately you yearned in the past for many of the things which you hate or despise now.,Leo Tolstoy
"Remember how many things you lost trying to satisfy your former desires. The same thing could happen now, with the desires which excite you at present. Try to tame your present desires, calm them; this is most beneficial, and most achievable.",Leo Tolstoy
"Perfecting the self is both an inner and an outer work: You cannot improve yourself without communicating with other people, influencing them, and being influenced by them.",Leo Tolstoy
"“Be perfect, as your heavenly Father,” Christ said. This does not mean that Christ asked people to be as good as God; only that everyone should strive for perfection.",Leo Tolstoy
"There is nothing more harmful to you than improving only your material, animal side of life. There is nothing more beneficial, both for you and for others, than activity directed to the improvement of your soul.",Leo Tolstoy
Why do people like to blame others so much? He who casts blame on another person is quick to think that he would not do the very same thing. It is the same with people who like to listen to the fault-finding of their neighbors.,Leo Tolstoy
"When two people have a dispute, both are to blame. And therefore, a dispute will stop only when at least one person understands that he or she is guilty.",Leo Tolstoy
"Stop blaming other people, and you will feel what an alcoholic feels when he stops drinking, or what a smoker feels when he stops smoking. You will feel that you have brought relief to your soul.",Leo Tolstoy
"The material evil caused by war is big, but it is incomparably small in comparison with the perversion or the understanding of good and bad which happens during the war, and which is put into the souls of people who do not think.",Leo Tolstoy
"A child meets another child with a smile, displaying his friendly attitude and joy. This same behavior lives in all sincere people. But very often, a man from one nation already hates a man from another nation, and is ready to cause him sufferings and even death, even before he meets him. Those who create these feelings in nations commit a terrible crime!",Leo Tolstoy
War creates a state in which power and glory is at the end too often received by the most undeserving and vicious people.,Leo Tolstoy
"The higher the opinion a person has of himself, the more unstable is his position; the lower he moves in his selfesteem, the firmer he stands.",Leo Tolstoy
"Try to find out your potential. After you know it, do not be afraid to underestimate it. Be cautious not to exaggerate it.",Leo Tolstoy
A person’s life is good only to the extent that it fulfills the expectations of the will of God.,Leo Tolstoy
"Evil, in the form of suffering and death, is everywhere apparent to a person who accepts the law of his material, animal existence as the major law of his life. Only when a man lowers himself to the state of an animal does death and suffering scare him. The only road open for him to escape that fear is the road of fulfillment of the law of God, the law which is expressed in love. There is no death and no suffering for a man who lives according to the law of God.",Leo Tolstoy
"We know the law of God, both as it is presented to us by the different religions of the world and as our own conscience, when it is not obscured by passion and prejudice, and we can easily understand the applications of this law to our life, for all real good stems from its requirements.",Leo Tolstoy
It is obvious for everyone that death expects us all in the long run; but nevertheless we live our lives as if there will be no death.,Leo Tolstoy
"The more deeply you understand life, the less you grieve over the destruction caused by death.",Leo Tolstoy
,Leo Tolstoy
Religion is a philosophy which can be understood by anyone.,Leo Tolstoy
Religion is simple wisdom which is directed to the heart and understood by the intellect.,Leo Tolstoy
