Quote,Author
"Only during a period of war does it become obvious how millions of people can be manipulated. People, millions of people, are filled with pride while doing things which those same people actually consider stupid, evil, dangerous, painful, and criminal, and they strongly criticize these things—but continue doing them.",Leo Tolstoy
"The reasons which governments give for wars are always screens, behind which lie completely different reasons and motives.",Leo Tolstoy
"Understanding our duty provides us with the understanding of our divine soul. And, too, the understanding of our divine soul gives us the understanding of duty.",Leo Tolstoy
The voice of your conscience is the voice of God.,Leo Tolstoy
Your conscience is your understanding of your spiritual origins; only when you possess such awareness will it be a real guide in your life.,Leo Tolstoy
"There are two different beings within you, one which is blind and sensual, and another which can see and is spiritual.",Leo Tolstoy
"This spiritual being is called conscience and can be compared with the needle of a compass which points at goodness at one end, and at the other, evil. We cannot perceive this compass until we stray from goodness, but as soon as we do something bad, then we feel this pull away from the direction of goodness in life.",Leo Tolstoy
Fear all that is not accepted by your conscience.,Leo Tolstoy
"In our time, the killing of animals for pleasure or food is almost a crime, and hunting and eating meat are not just trivial things, but bad actions, which like any other bad actions lead to many other actions which are worse.",Leo Tolstoy
The misery of the unintellectual life brings us to the need for an intellectual life.,Leo Tolstoy
"Before, I lived in sin, and I saw that the majority of people around me lived in the same way. Like a robber, I knew I was unhappy and I suffered, and that people around me were unhappy and they suffered; and I didn’t see any way out of this situation except for suicide or death. Life seemed terrible to me. And then I heard the words of Christ and I understood them. And life ceased to seem an evil, and instead of desperation I felt a happiness for life which surpasses even death.",Leo Tolstoy
"When you suffer, think not on how you can escape suffering, but concentrate your efforts on what kind of inner moral and spiritual perfection this suffering requires.",Leo Tolstoy
"All the misfortunes of mankind collectively and individually are not useless; they bring people and individuals and nations in different ways closer to the purpose which is set before them: the appearance of God, for every person in himself, and in all mankind.",Leo Tolstoy
There is only one true religion for all of mankind.,Leo Tolstoy
"We can believe in a thing, we can know that it exists, even if we cannot understand it with our intellect, or explain it with words.",Leo Tolstoy
Do not fear hesitations but study the different faiths and religions intellectually.,Leo Tolstoy
Only he who accepts that the essence or meaning of his life is not material but spiritual can be free.,Leo Tolstoy
"A slave who is happy with his state is a slave twice over, because not only his body but his soul is enslaved.",Leo Tolstoy
There is no middle way: either be a slave of people or of God.,Leo Tolstoy
Understanding or mindfulness of death teaches one to choose the things which are complete or could be completed; and those things are the most important.,Leo Tolstoy
"There is no death for the spirit; therefore, a person who lives a spiritual life is freed from death.",Leo Tolstoy
"Whenever you ask whether you should behave in this way or the other, ask yourself, what would you do if you knew that you could die this evening, and nobody would find out about your action? Death spurs people to finish their affairs; among all actions, there is only one type which is complete, and that is love which seeks no reward.",Leo Tolstoy
It is very useful to notice the impression which our life and deeds make upon other people.,Leo Tolstoy
Never try to justify your deeds.,Leo Tolstoy
Love provides a person with the purpose of his life. Intellect shows him the means to achieve that purpose.,Leo Tolstoy
"If a person lacks intellect, he can not distinguish bad from good, and so he can neither truly seek nor truly have real goodness.",Leo Tolstoy
A good life is given only to those who make efforts to achieve it.,Leo Tolstoy
"In order to have a good life, you should not be afraid of any good deeds. You should have no less power or strength for small acts than for the biggest and greatest good deed.",Leo Tolstoy
"Try to live a good life in accord with the virtues that are set before you. Perhaps this is a difficult thing, but with time it becomes more and more joyful.",Leo Tolstoy
"If you need goodness, follow God’s law. And to follow the law of God is possible only by making an effort. Not only is this effort rewarded with a happy life, but even the effort itself gives the biggest blessing of life.",Leo Tolstoy
"The family relationship is only good and firm and giving of virtue to people when it goes beyond family and is also religious, and all the members of the family believe in one God and His law. Otherwise, the family is the source not of pleasure but of suffering.",Leo Tolstoy
"One of the most common explanations for bad deeds is the family name. People steal, make bribes, do many other nasty things in life, all of which can be explained by their love for their family.",Leo Tolstoy
"Family love is a selfish feeling, and therefore it can justify bad, unworthy actions.",Leo Tolstoy
"In family love, in the moral high meaning, there is nothing good or bad, just as in self-love. Both are natural. Love of your family, as well as of yourself, when it surpasses its limits, can be a vice, but it can never be a virtue, because it’s a natural feeling.",Leo Tolstoy
"Depression is a state of the soul in which you can see no sense either in your own life or in the life of the world. This state is not only painful for the people around you, but it can influence them, and a truly good person deals with this unpleasantness when he is alone. When you have bad spirits or are in a low mood, or you are irritated, you should be so in solitude.",Leo Tolstoy
"When everything you see appears in dark, gloomy shades, and seems baleful, and you want to tell others only bad and unpleasant things, do not trust your perceptions. Treat yourself as though you were drunk. Take no steps and actions until this state has disappeared.",Leo Tolstoy
You should never feel depressed.,Leo Tolstoy
"A man should always feel happy; if he is unhappy, it means he is guilty.",Leo Tolstoy
"O Lord, help me to be always happy and to rejoice following and fulfilling your will.",Leo Tolstoy
"Both our physical sufferings and periods of depression are part of our life in this world, and we should patiently wait until they are over, or our life is over.",Leo Tolstoy
"As soon as a person asks himself the question, “How do I live my life in the best way?” then all other questions are answered.",Leo Tolstoy
"Real living takes place not in the domain of outward change, but in the inner domain, where changes can hardly be observed, in our spiritual life.",Leo Tolstoy
"The more people believe that others can improve their lives, the slower any improvement will occur.",Leo Tolstoy
The human soul is divine.,Leo Tolstoy
"Life is given to us in the same way as a child is given to a nanny, so that it can be raised to maturity.",Leo Tolstoy
"Keep yourself in purity, far from evil, so that divine power may come through you. And in this flow of divine power through you, there is great bliss.",Leo Tolstoy
"There is no other domain where the words of our language are so misused as in the criticism of art, especially of false art.",Leo Tolstoy
"There are two very clear indications of real science and real art: the first inner sign is that a scholar or an artist works not for profit, but for sacrifice, for his calling; the second, outer sign is that his works are understandable to all people. Real science studies and makes accessible that knowledge which people at that period of history think important, and real art transfers this truth from the domain of knowledge to the domain of feelings.",Leo Tolstoy
"Creating art is not as elevated a thing as many people guess, but certainly it is a useful and kind thing to do, especially if it brings people together and arouses kind feelings in them.",Leo Tolstoy
A person is enslaved to the extent he believes that his life has only a physical beginning.,Leo Tolstoy
"If you feel that you are not free, look for the reason inside you.",Leo Tolstoy
Punishment is a notion that humankind gradually outgrows.,Leo Tolstoy
"A person has done evil, so another person, or a group of people, in order to fight this evil, cannot think of anything better than to create another evil, which they call punishment.",Leo Tolstoy
"Every punishment is based, not on logic or on the feeling of justice, but on the desire to wish evil on those who have done evil to you or to another person.",Leo Tolstoy
Capital punishment is a very clear proof that our society’s organization is far from being a Christian one.,Leo Tolstoy
Everything about our present system of punishments and about all criminal law will be thought of by future generations in the same way that we think of cannibalism or human sacrifice to ancient pagan gods. “How did they not see the uselessness and cruelty of those things which they did?” our descendants will say about us.,Leo Tolstoy
"To punish others is like putting more wood in the fire. Every crime already has punishment in itself, and it is more cruel and more just than the punishment created by people.",Leo Tolstoy
"We should remember that the desire to punish is part of a very low animal feeling which should be suppressed, and which should not be a part of our reality.",Leo Tolstoy
"Follow the best way of life you possibly can, and habit will make this way suitable and pleasant for you.",Leo Tolstoy
"Everything is from God; therefore, everything is good. Evil is goodness which we did not understand because of our shortsightedness.",Leo Tolstoy
"When one understands that kind of evil which is in his deeds, then all other misfortunes to which he can be subjected are nothing as compared with the pleasure and freedom he can then experience.",Leo Tolstoy
"Neither the descriptions of war nor its terrible cruelties and atrocities can stop people from participating in it. One reason for this is that by viewing the atrocities of war, everyone comes to understand that if such a terrible thing can exist and be accepted by people, then there must be some reason for its existence.",Leo Tolstoy
The time has come to talk about the evils of war. It is not true that the existence of wars proves their necessity. The history of mankind says that such things should not happen.,Leo Tolstoy
To deny God is to deny yourself as a spiritual and intellectual being.,Leo Tolstoy
"I know God and soul not by their definition, but in another way entirely. Striving to define God destroys this knowledge in me. I know that God exists, that my soul exists; this knowledge is clear to me because I was given it. I have not the slightest doubt about the existence of God, if I ask: What am I? Who am I? My legs are not me; my arms are not me; my head is not me; my feelings are not me; even my thought is not me. Then what am I? I am myself, I am my soul. No matter which side I approach this question, I inevitably come to God. The beginning of my life is God, the beginning of my existence is God. The same with the soul. If I want to know the truth, I know that at the beginning of all is my soul; if I want to understand my feeling of love and necessity for goodness, then I again find the source of this in my soul.",Leo Tolstoy
"Life in this world goes according to somebody’s will—someone performs special actions upon all life in this world, and touches all our lives. That which performs these actions is what we call God.",Leo Tolstoy
That feeling which solves all of the contradictions of human life and gives one the greatest bliss is known to all people: this feeling is love.,Leo Tolstoy
"Love destroys death and makes it empty; it gives meaning to senseless things; from unhappiness, love makes real happiness.",Leo Tolstoy
"The less love a person has, the more he suffers.",Leo Tolstoy
"If you are in a difficult situation, a low mood, if you are afraid of other people and of yourself, if you are tormented, then tell yourself: “I will love everyone whom I meet in this life.” Try to follow this rule; and you will see that everything will find its way, and everything will seem simple, and you will no longer have doubts or fears.",Leo Tolstoy
People mistakenly think that virtue lies in the knowledge of many things. What is important is not the quantity but the quality of knowledge.,Leo Tolstoy
"Do not fear the lack of knowledge, fear false knowledge. All evil in this world comes from false knowledge.",Leo Tolstoy
Knowledge born in argument and discussion is to be doubted.,Leo Tolstoy
"In the world today, real faith has in most cases been replaced by public opinion. People do not believe in God, but they believe in many minor things which are taught by other people.",Leo Tolstoy
"People’s misfortunes are caused not because they do not know their duties, but because they misunderstand their duties.",Leo Tolstoy
Faith is not achieved by a majority of votes.,Leo Tolstoy
The major reason for the evil that exists today is the absence of faith in people of our time.,Leo Tolstoy
Truly virtuous is the person who gives his love to the weak.,Leo Tolstoy
"If a rich person could be truly virtuous, then he would stop being rich very quickly.",Leo Tolstoy
The foundation of love is in each person’s understanding of the unity of the divine spark which lives in all people.,Leo Tolstoy
All that brings unification to people is goodness and beauty; all that brings separation among them is evil. All people know this: it is firmly inscribed on our hearts.,Leo Tolstoy
"We are separate beings, it seems, but in our inner life we are closely connected with all living things.",Leo Tolstoy
"We can feel some of the vibrations of this spiritual world; some of them have not reached us yet, but they are moving, as the vibrations of light from the distant stars are moving across the universe; they move, though they are not yet visible to our eyes.",Leo Tolstoy
The existing order of things can he improved.,Leo Tolstoy
"In order to fulfill the law of God as we understand it, a joint effort must be made by many people. Then, maybe slowly, we will move to an understanding of this divine law.",Leo Tolstoy
"God’s kingdom is the fulfillment among mankind of God’s will, according to the measure in which it is revealed to us.",Leo Tolstoy
"In the life of the world, thousands of years look like one year. Therefore, we should work hard at the fulfillment of eternity, and we should wait for the day when religion will enlighten this world completely.",Leo Tolstoy
"The kingdom of God is inside us; therefore look for the kingdom of God inside you and the rest will take care of itself, in the best possible way.",Leo Tolstoy
"My material life is subject to suffering and death, and no effort of mine can release me from suffering or death. My spiritual life is subject neither to suffering nor death. Therefore, salvation from suffering and death lies in only one thing: in the transfer of my conscious “self” from the material to the spiritual.",Leo Tolstoy
"The way to understand this world is to understand your inner self. With the help of love, and by virtue of the love of others, we understand other beings: people, animals, plants, stones, heavenly bodies; and we understand the attitudes of these beings to themselves; and these attitudes create the whole world as we know it. The way to understanding is based on love, on unification with all other creatures in the world.",Leo Tolstoy
That which we understand as the happiness or unhappiness of our animal “self” depends on the highest spiritual will.,Leo Tolstoy
"Nothing can support idleness better than empty chatter. People would be better to keep silent and not speak the boring, empty things they routinely say to entertain themselves. How can they endure it?",Leo Tolstoy
Those people speak most who do not have much to say.,Leo Tolstoy
"The less you speak, the more you will work.",Leo Tolstoy
"The foundation of ancient societies was violence. The basis of our contemporary society is wise concord, the negation of violence.",Leo Tolstoy
"Some people think that it is impossible to rule other people without violence. And so they do to people as other people do with horses, when they blind their eyes so that they will more obediently walk in a circle.",Leo Tolstoy
For what purpose is a man’s intellect if you are going to influence him only with violence?,Leo Tolstoy
"In all cases, when people use violence, you should try to convince them not to. You should try to apply wise, convincing arguments, appealing not to the everyday world, but to their higher spiritual understanding. Then, when you succeed, you will have the complete satisfaction of your conscience.",Leo Tolstoy
"People believe in eternal life because they believe that life’s beginning is spiritual, and therefore eternal.",Leo Tolstoy
"A person is not afraid to die only after he understands that he was never born, that he always existed, exists at present, and will always exist.",Leo Tolstoy
"A person will believe in his eternity when he understands that his life is not a wave, a period of time, but the eternal movement which is manifested in this life only as a wave.",Leo Tolstoy
Those who believe that their life has not begun with their birth and will not end with death find it much easier to live a good life than those who do not understand or believe this.,Leo Tolstoy
"Really true, good, and great things are always simple.",Leo Tolstoy
"Very often the simplest and least educated people can easily and unconsciously understand the meaning of life while the most scholarly people lack this ability, because they have been too educated to understand the simple things that are basic to all people.",Leo Tolstoy
"If you want to find an example to follow, you should look among simple, humble folk. There is real greatness only in those who do not advertise themselves, and who do not understand themselves as great.",Leo Tolstoy
"The feeling of compassion for other living beings reminds me of the feeling of pain in our body. Just as you can become less sensitive to pain in your body with time, you can become less compassionate to others.",Leo Tolstoy
"When the suffering of another creature causes you to feel pain, do not submit to the initial desire to flee from the suffering one, but on the contrary, come closer, as close as you can to him who suffers, and try to help him.",Leo Tolstoy
"Love is the manifestation of the divine nature which exists above time. Love is not only a way of life, it is an action directed toward the goodness of others.",Leo Tolstoy
There is no love in the future. Love can exist only in the present moment. A man who does not manifest love in the present does not love at all.,Leo Tolstoy
Be kind even if the world blames you. It is better than the converse when a person is praised by others but continues to be bad.,Leo Tolstoy
"Certainly, it is painful to recall all the things which you could have done in the past but did not: some charity, for example; a time you denied to those who expected help from you; or when you blocked the joyful understanding of completing an action you should have finished.",Leo Tolstoy
Faith is not true faith if love is not in harmony with it.,Leo Tolstoy
"If a person is not in a hurry to fulfill the things which he understands as the law of God, then he believes neither in the law, nor in God.",Leo Tolstoy
Effort is the necessary condition of moral perfection.,Leo Tolstoy
Those who think that they can live a high spiritual life whose bodies are filled with idleness and luxuries are mistaken.,Leo Tolstoy
"If you were abused, make an effort to love those who have abused you. If you have abused someone, make an effort to correct the evil which you created.",Leo Tolstoy
"When one understands life’s law, one manifests the part of God which lives inside him.",Leo Tolstoy
"In the long run, people achieve only that which they have set as goals for themselves; therefore, set the highest possible goals for yourself.",Leo Tolstoy
The fulfillment of the law of goodness has nothing in common with everyday material prosperity. Sometimes material prosperity and moral goodness clash in conflict. These sufferings lead to the highest elevation of spirit.,Leo Tolstoy
"Sometimes we cannot see any connection between our suffering and our sin, but this connection definitely exists.",Leo Tolstoy
"“I was repaid with evil for the goodness which I have done.” But if you love those for whom you did good, then you have already received your reward. Therefore, all that you do with love, you do for yourself.",Leo Tolstoy
"Look for the causes of the evil from which you suffer in yourself. Sometimes this evil is the direct consequence of your activity; sometimes it happens after a lengthy period of transformation of an evil which you committed long ago. But the source is always in you, and salvation from it lies in changes in your actions, your way of life.",Leo Tolstoy
"In every faith, only what is spiritual is true.",Leo Tolstoy
"If you do not believe that at its beginning, your life came from spirit, why are you looking for it elsewhere, thinking that you can find spirit in other places? He who behaves in this way is like the man who burns a lantern in bright sunlight.",Leo Tolstoy
"Do not be afraid to get rid of things which distract your attention—everything material, everything which can be seen or can be felt. The more you purify the spiritual core of your faith, the firmer your faith will be.",Leo Tolstoy
"Knowledge is a tool, not a purpose.",Leo Tolstoy
"People know little, because they try to understand those things which are not open to them for understanding: God, eternity, spirit; or those which are not worth thinking about: how water becomes frozen, or a new theory of numbers, or how viruses can transmit illnesses. How to live your life is the only real knowledge.",Leo Tolstoy
"People who think that the most important thing in life is knowledge remind me of a butterfly who flies into the flame of a candle, and in so doing burns, and extinguishes the light.",Leo Tolstoy
"The purpose of life is the fulfillment of the law of God, not the acquisition of ever more knowledge.",Leo Tolstoy
Repentance always precedes perfection. It is sad that people think repentance is unnecessary.,Leo Tolstoy
Not to accept your mistakes is to increase them.,Leo Tolstoy
You should live in such a way that you can confide anything on your mind.,Leo Tolstoy
"The more important something is in your life, the more harmful it can be for you in the future if you abuse it. The misfortunes and woes of people often come from the abuse of the most precious tool of our life: intellect.",Leo Tolstoy
"God gave his spirit, his intellect, to us, so that we can understand his will and fulfill it; but we misuse it and apply this spirit for the fulfillment of our own will.",Leo Tolstoy
When a person tries to apply his intellect to the question “Why do I exist in this world?” he becomes dizzy. The human intellect cannot find the answers to such questions. What does this mean? This means that our intellect is not given to us to find a solution for this question. Our intellect can only answer the question: “How shall I live?” And the answer is simple: “We should live so as to bring good to all people.”,Leo Tolstoy
The purpose of the intellect is to reveal the truth; therefore it is a harmful misconception to pervert the truth with intellectual efforts.,Leo Tolstoy
Only those who know their weaknesses can be tolerant of the weaknesses of their neighbors.,Leo Tolstoy
"Almost always, when we look deep into our souls, we can find there the same sins which we blame in others. If we do not find a particular sin in our soul, then we should look more closely, and we will find even worse sins there.",Leo Tolstoy
"If we can put ourselves into the place of other people, we lessen our pride.",Leo Tolstoy
"If Christians would follow the law, there would be no rich and no poor.",Leo Tolstoy
"Wealth reminds me of manure in the field. When it is in a big pile it makes a bad smell. But when it is distributed everywhere across the field, it makes the soil fertile.",Leo Tolstoy
"A person must completely close his eyes on his morals, that in a Christian society so filled with people in need, there are other people who are so proud to have great wealth.",Leo Tolstoy
"The intellect can liberate a person; the less of an intellectual life one has, the less liberated one is.",Leo Tolstoy
"A wise person lives in accordance with his desires, because he wants only that which is attainable. Such a person is free.",Leo Tolstoy
"We have created a way of life which is contrary to mankind’s moral and physical nature, and yet we want to be free while living this kind of life.",Leo Tolstoy
"Freedom cannot be achieved by looking for it, but in looking for truth. Freedom should not be a purpose, but a consequence.",Leo Tolstoy
Freedom cannot be granted to you by others. Each person can liberate only himelf.,Leo Tolstoy
