Quote,Author
"During our lives we help each other: sometimes we help other people, sometimes we are helped by others. But the world is formed so that usually some people mostly help others, and some mostly receive their help.",Leo Tolstoy
"As you acquire objects, and you use them, you should keep in mind that they are the products of people’s work. When you damage or destroy these objects, you damage or destroy the toil, and this part of the life, of other people.",Leo Tolstoy
"Help should be mutual. Moreover, those who accept help and assistance from their brothers should pay them back, not only with money, but with love, respect, and gratitude.",Leo Tolstoy
The most important change that can occur in a person’s life is a change in his faith.,Leo Tolstoy
"Individuals die, but the wisdom they have obtained in their lives does not die with them. Mankind keeps all this wisdom, and a person uses the wisdom of those who lived before him. The education of mankind reminds me of the creation of the ancient pyramids, in that everyone who lives puts another stone in the foundation.",Leo Tolstoy
"It is a big mistake to think that faith is immutable, that it does not change over generations. The longer mankind exists y its faith becomes simpler and stronger. And the simpler and stronger our faith becomes, the better we live.",Leo Tolstoy
"If you believe that faith is the same for all times and that it cannot be changed, you might just as well believe that those fairy tales and proverbs and children’s stories which your grandmother told you when you were a small baby are real, and that you ought to believe in them all your life.",Leo Tolstoy
"The more a person believes in God, the less he is afraid of other people.",Leo Tolstoy
Those who fear people do not fear God; those who fear God do not fear people.,Leo Tolstoy
"He who is not afraid of anything, and who is ready to give his life for a righteous cause, is much stronger than he whom other people fear and who has the lives of other people in his power.",Leo Tolstoy
Look for the better men among those who are despised.,Leo Tolstoy
"Do what you think is necessary, and do not expect reward. Remember that a stupid person is a bad judge of clever deeds.",Leo Tolstoy
"You want to save yourself from the power of other people—give yourself to the power of God. If you see yourself as being in the power of God, then people cannot do anything to you.",Leo Tolstoy
"Wisdom can be achieved by inner work, through solitary communication with yourself; it also can be achieved when you communicate with other people.",Leo Tolstoy
"Real love is not in words but in deeds, and only love can give you real wisdom.",Leo Tolstoy
"When you are in company, do not forget what you have found out when you were thinking in solitude; and when you are meditating in solitude, think about what you found out by communicating with other people.",Leo Tolstoy
"If sometimes you feel that in spite of all your wishes to gain triumph over your passions, they gain victory over you, do not think that you cannot conquer them at all. You have only proven that you weren’t able to this one time. A good groom does not drop his reins when he cannot stop his horses at once but tries again to pull the reins, and eventually the horses stop. So if you could not resist the temptations once, continue your fight, and in the end not your passion but you will gain the victory.",Leo Tolstoy
"Try to be the master over greed, sloth, lechery, and rage.",Leo Tolstoy
"Abstention cannot be achieved at once, but it should be a process, and a constant effort. The life of a person who makes this effort is directed not to the calming of his passions but to the mastery of them.",Leo Tolstoy
Time and persistence help you in these efforts.,Leo Tolstoy
"The truth is not only a joy, it is an instrument in conflict much more powerful than violence.",Leo Tolstoy
"If you have parted from a person, and he was not satisfied with you, or did not agree with you when you were right, he is not to blame, but probably it is you who are to blame, because you were not kind enough with this man.",Leo Tolstoy
"To repent means to show your vices and weaknesses to all. Repentance means taking responsibility for all of the bad things you have done, purifying your soul, and preparing to accept goodness.",Leo Tolstoy
"When a kind man does not accept his mistakes and tries always to justify himself, he becomes an unkind man.",Leo Tolstoy
"Do you have qualities which can be criticized and improved? Try to admit that this is so, and to find these qualities out by yourself.",Leo Tolstoy
A man will always understand his sins as well as his limits in this limitless world.,Leo Tolstoy
"Science can be divided into an infinite number of disciplines, and the amount of knowledge that can be pursued in each discipline is limitless. The most critical piece of knowledge, then, is the knowledge of what is essential to learn and what isn’t.",Leo Tolstoy
Beware of false knowledge. All evil comes from it.,Leo Tolstoy
"Knowledge is limitless. Therefore, there is a minuscule difference between those who know a lot and those who know very little.",Leo Tolstoy
"The only real life is one lived close to God. This does not happen by itself; you must make an effort to make this happen, and this effort will bring you joy.",Leo Tolstoy
"Spiritual effort and the joy that comes from understanding life go hand in hand like physical exertion and rest. Without physical exertion, there is no joy in rest; without spiritual effort, there can be no joyful understanding of life.",Leo Tolstoy
"When I die, only one of two things can happen: either this essence which I understand as myself will transform into a different being, or I will stop being a separate individual and become a part of God. Either possibility is good.",Leo Tolstoy
Death is the destruction of this body with which I understand the world in this life. It is the destruction of the glass through which I look at the world. And we do not know whether this glass will be replaced by another; or whether the essence which looks through the window will integrate with the world. We cannot know this.,Leo Tolstoy
"You should live your life so that you are not afraid of death, and at the same time do not wish to die.",Leo Tolstoy
Life should and can be limitless joy.,Leo Tolstoy
"Life in this world is not a vale of tears, not a trial, but a thing that surpasses our imagination. Life could be limitless joy, if we would only take it for what it is, in the way it is given to us.",Leo Tolstoy
"A person’s unfriendly attitude to other people makes life unhappy, both for that person and for those who surround him. A friendly mood and loving attitude are as an oil which lubricates the wheels of life, making them move easily and smoothly.",Leo Tolstoy
A truly wise man is always joyful.,Leo Tolstoy
"The best way to live joyfully is to believe that life was given for joy. When joy disappears, look for your mistake.",Leo Tolstoy
"It is difficult to avoid working in life without either sinning, committing violence, being a party to violence, or by flattering and pleasing the agents of violence.",Leo Tolstoy
You will find that people unwilling to work will either take advantage of others or be humiliated by them.,Leo Tolstoy
"People involve themselves in countless activities which they consider to be important, but they forget about one activity which is more important and necessary than any other, and which includes all other things: the improvement of their soul.",Leo Tolstoy
"“Be perfect, as your Father in heaven is perfect.” This means that you should try to find the presence of the Holy Spirit in your soul.",Leo Tolstoy
"To improve ourselves, to move toward that goal, perfection, that puts no less a demand on us for being unattainable, requires solitude, removal from the concerns of everyday life. And yet constant solitude renders self-improvement impossible, if not pointless. A balance must be struck between meditating in solitude and then applying this to your everyday life.",Leo Tolstoy
"To repay evil with goodness is easier, wiser, and more natural than to repay evil with evil.",Leo Tolstoy
Those who take joy in repaying an evil with goodness will always try to experience this joy again.,Leo Tolstoy
"People think that if they call mass murder “war,” then mass murder will stop being a murder, a crime.",Leo Tolstoy
"And because lawlessness is increased, most people’s love will grow cold.",Leo Tolstoy
"Murder is always a crime, no matter whom, and how it is justified.",Leo Tolstoy
Love of goodness and faith in immortality are inseparable.,Leo Tolstoy
"We live in this world like a child who enters a room where a clever person is speaking. The child did not hear the beginning of the speech, and he leaves before the end; and there are certain things which he hears but does not understand. In the same way, the great speech of God started many, many centuries before we started learning, and it will continue for many centuries after we turn to dust. We hear only part of it, and we do not understand the biggest part of what we hear, but nevertheless, a bit vaguely, we understand something great, something important.",Leo Tolstoy
"If you truly love goodness (God), then you cannot have doubts in your immortality.",Leo Tolstoy
The holy spirit which exists in people is liberated more and more. This will change our existing world order.,Leo Tolstoy
Real science shows us how to apply our religious faith to our outer Uves. Art shows us how to apply it to our feelings.,Leo Tolstoy
"The more we understand our divine nature, the more its rules should be fulfilled in our actions.",Leo Tolstoy
"Everything is connected more closely in the spiritual world than in the material world. Every lie brings multiple lies, every cruelty brings more cruelty.",Leo Tolstoy
"Be attentive to the appearance of evil. There is an inner voice in your soul which always tells you about approaching evil You feel unpleasant, you feel ashamed. Believe in this voice; stop and seek to improve yourself, and then you will defeat evil.",Leo Tolstoy
"At a certain level of self-awareness, a person understands something supernatural in himself.",Leo Tolstoy
God exists only for those who look for Him. Start looking: you will find Him in you and yourself in Him.,Leo Tolstoy
"It is surprising that I could not see a very simple truth: behind and above this world and our lives, there is someone who knows why this world exists and why we exist in this world. And our lives are as bubbles in boiling water, which appear, rise to the surface, pop, and disappear.",Leo Tolstoy
"Just because a person does not understand God, he has no right to draw the conclusion that God does not exist.",Leo Tolstoy
"We understand the divine, spiritual beginning of our life both with our intellect and with our love.",Leo Tolstoy
"A man is wise who does three things: first, he does by himself those things which he advises others to do; secondly, he does not do anything that contravenes the truth; and thirdly, he is patient with the weaknesses of those who surround him.",Leo Tolstoy
Investigate everything: believe only in those things which exist in accordance with intellect.,Leo Tolstoy
"A clever person cannot be evil. A kind person is always clever. Improve your kindness by exercising your intellect, and improve your intellect by exercising your kindness and love.",Leo Tolstoy
We cannot hope to obtain any sort of perfection in a society which is divided into two parts: rich people who rule the world and poor people who obey their orders.,Leo Tolstoy
It is worse to be an oppressive master than an obedient slave. Excessive wealth is worse than poverty.,Leo Tolstoy
"The consequences of our notions cannot be known to us, because they ripple outward limitlessly in a limitless world.",Leo Tolstoy
Our most important actions are those consequences which we will not see.,Leo Tolstoy
"If you can see all of the consequences of your actions, then your actions are of no use.",Leo Tolstoy
"To accept the dignity of another person is an axiom. It has nothing to do with subduing, supporting, or giving charity to other people.",Leo Tolstoy
The smallest detail can benefit the strengthening of character. Do not say that small details are not important; only a person with high morals can see their importance.,Leo Tolstoy
"Some of the most religious people in Russia have an interesting habit: they make a low bow to persons to whom they are introduced for the first time. They say they do this to acknowledge the divine spirit that every person has within himself. This is not a widespread tradition, but its foundations are very deep.",Leo Tolstoy
"A person should know that he performs true charity not in front of other persons, but before the eternal law of God.",Leo Tolstoy
Christianity is the study of the divine beginning in a person.,Leo Tolstoy
"Without the clear understanding of the meaning of one’s life, without faith, a person can at any minute deny good and start worshiping evil.",Leo Tolstoy
A person cannot have complete understanding of the meaning of life. A person can only know its direction.,Leo Tolstoy
"The essence of all religious teachings is love. What is special in Christianity is teachings about love, the clear and exact statement of the major condition of love: nonresistance to evil and violence.",Leo Tolstoy
"If you want to be quiet and strong, work and improve your faith.",Leo Tolstoy
"What is important is not the quantity of your knowledge, but its quality. You can know many things without knowing that which is most important.",Leo Tolstoy
Ignorance in itself is neither shameful nor harmful. Nobody can know everything. But pretending that you know what you actually do not know is both shameful and harmful.,Leo Tolstoy
"Vague and complex terminology was created by false scholars. Real, truthful knowledge does not need vague terms.",Leo Tolstoy
A man who does not understand the benefit of suffering does not live a clever and true life.,Leo Tolstoy
"Without suffering, spiritual growth cannot happen. Suffering often accompanies death, but suffering is also a useful, beneficial condition of life. It is said that God loves those who experience suffering.",Leo Tolstoy
"A person who lives a spiritual life cannot help but see that suffering brings him closer to God. Seen in this light, suffering loses its bitter side and becomes bliss.",Leo Tolstoy
"For a person who leads a spiritual life, self-sacrifice brings a bliss that far transcends the pleasure of a person who lives by the self-indulgent satisfaction of his animal passions.",Leo Tolstoy
"Just as fire blows out candles, good deeds for the benefit of others destroy a selfish life.",Leo Tolstoy
"The dark spot in the sunlight that falls on us is the shadow created by our own personalities. We live for ourselves only when we live for others. It may seem strange, but try it, and you will see it from your own experience.",Leo Tolstoy
"In the future, the order of the social life of the Christian world will be changed by the replacement of violence and its fears with love and blessing.",Leo Tolstoy
"It is a mistake to think that there are times when you can safely address a person without love. You can work with objects without love—cutting wood, baking bricks, making iron—but you cannot work with people without love. In the same way as you cannot work with bees without being cautious, you cannot work with people without being mindful of their humanity. It is the quality of people as it is of bees: if you are not very cautious with them, then you harm both yourself and them. It cannot be otherwise, because mutual love is the major law of our existence.",Leo Tolstoy
You should live so that it is possible to create the kingdom of love on earth. You should live a life based not on violence but on love.,Leo Tolstoy
The greatest knowledge is self-knowledge. He who understands himself will understand God.,Leo Tolstoy
"A person can transform his personality, his inner self, from the domain of suffering and subduing into the domain which is always steady and joyful, that is, the domain of understanding his spiritual and divine essence.",Leo Tolstoy
Real goodness is always simple.,Leo Tolstoy
Simplicity is so attractive and so profitable that it is strange that so few people lead truly simple lives.,Leo Tolstoy
"Every great thing is done in a quiet, humble, simple way; to plow the land, to build houses, to breed cattle, even to think—you cannot do such things when there are thunder and lightning around you. Great and true things are always simple and humble.",Leo Tolstoy
No one looks less simple than those people who artificially strive to seem so. Artificial simplicity is the most unpleasant of all artificial things.,Leo Tolstoy
In any struggle true bravery lies within those who know that God is their ally.,Leo Tolstoy
"Whatever happens, do not lose faith. Nothing bad can happen to you as a human being.",Leo Tolstoy
"Only a person who renounces his personality becomes truly powerful. As soon as one denies his personality, it is not he but God who acts through him.",Leo Tolstoy
"Once upon a time, a Roman empress lost her precious jewelry. It was announced across the empire that whoever found her lost stones before thirty days would receive a big reward, but any who returned the jewelry after thirty days would be executed. Samuel, a Jewish rabbi, found the precious stones, but he returned them after thirty days had passed. “Have you been abroad?” the Roman empress asked him. “No, I was at home.” “Maybe you did not know what was proclaimed?” “No, I knew,” said Samuel. “Then why did you not return these things before the expiry of the thirty days? Now you have to be executed.” “I wanted to show you that I returned your lost jewelry, not because of fear of your punishment, but because of fear of God.”",Leo Tolstoy
"A person can understand himself as a material or a spiritual being. When you understand yourself as a spiritual being, then you are free.",Leo Tolstoy
"What is “love of God,” if it is not the effort to add part of yourself to the higher creative flow of energy in this world? Divine force exists in everything, but the greatest manifestation of it in this world is in humanity, and in order to put it to work, one must understand it and accept it.",Leo Tolstoy
"If a person does not believe himself capable of doing the best things in the world, then he starts to create the worst things.",Leo Tolstoy
,Leo Tolstoy
The understanding of the existence of God is accessible to everybody; the complete understanding of the essence of God is not accessible to any person.,Leo Tolstoy
"Live in God, live together with God, by understanding Him in you, and do not try to define Him with words.",Leo Tolstoy
"A bad mood is often the reason for blaming others; but very often blaming others causes bad feelings in us: the more we blame others, the worse we feel.",Leo Tolstoy
"One of our most common and widespread prejudices is that every person has a fixed, special characteristic, that there are kind people and evil, clever people and stupid people, and cold or hot people. But people are not like this; we can say about a person only that he is more often kind than evil, more often clever than stupid, more often cold than hot. We always divide people like this, but it is no less wrong.",Leo Tolstoy
"If there is animosity between two people, both are to blame. Any number you multiply by zero, however big, will equal zero. If there is animosity, then, it is the animosity of two people toward each other, and it exists in both of them.",Leo Tolstoy
"If you are living with another person, make an agreement that as soon as either of you starts to blame the other, you will end the argument.",Leo Tolstoy
"Work is the necessary condition of happiness. First, favorite and free work; secondly, the physical work which arouses your appetite and afterward gives you tranquil and sound sleep.",Leo Tolstoy
"Manual labor does not exclude intellectual activity, but improves its quality and even helps it.",Leo Tolstoy
"Work is necessary. If you want a good disposition of your spirit, work until you become tired. But not too much. Not until you become exhausted. A good spiritual disposition can be destroyed by excessive work as well as by idleness.",Leo Tolstoy
A person can fulfill his purpose in life equally as well in illness as in health.,Leo Tolstoy
"If we meditate upon the existence of life after death, then all illnesses would seem to be taking us closer to the movement from one life to another, a transfer more desirable than undesirable. During these pains we can understand and explain for ourselves what will happen to us, and prepare for the new state of our next existence.",Leo Tolstoy
"Usually people think that it is possible to serve God and humanity only when you are healthy. This is not true. Very often it is to the contrary. Christ served God and all mankind when he suffered on the cross, and even then he forgave those who killed him. Every person can do likewise. You cannot say which state is better, a healthy or ill state, in the service of God and humankind.",Leo Tolstoy
"For yourself, and for yourself only, it is necessary to have health and power. But to serve God it is not necessary, and sometimes even the opposite is true.",Leo Tolstoy
"Very often, when I have dealt with terminally ill people, I have learned that the most important thing is not hiding the approaching death from the patient, but on the contrary, explaining to him his own divine, spiritual nature, which grows in him and which cannot be destroyed by death.",Leo Tolstoy
"Illnesses almost always destroy one’s physical power, and they release the power of one’s soul. For a person who concentrates his consciousness in the spiritual domain, illnesses do not diminish his goodness, but on the contrary, they increase it.",Leo Tolstoy
It seems that it is impossible to live without discovering the purpose of your life. And the first thing which a person should do is to understand the meaning of life. But the majority of people who consider themselves to be educated are proud that they have reached such a great height that they cease to care about the meaning of existence.,Leo Tolstoy
The real purpose of our existence is to understand this limitless life existing in this world.,Leo Tolstoy
"A person may not know the purpose of his life, but he should knowhowto live.",Leo Tolstoy
"A worker at a big plant may not necessarily know the purpose of his labor, but if he is a good worker, he should know how to do well what he should do.",Leo Tolstoy
"Every living being has sensory organs which reveal to it its place in the world. For a human, the primary sense is the intellect.",Leo Tolstoy
"If you do not know your place in the world and the meaning of your life, you should know that there is something to blame; and it is not the social system, or your intellect, but the way in which you directed your intellect.",Leo Tolstoy
He who sees his life as a process of spiritual perfection does not fear external events.,Leo Tolstoy
,Leo Tolstoy
"People very often do not accept the truth, because they do not like the form in which the truth is presented to them.",Leo Tolstoy
"One should avoid disputes; when afire becomes too big, it is difficult to quell it.",Leo Tolstoy
"If you know the truth, or if you think that you know the truth, try to pass it on to the others, as simply as you can, along with the feeling of love for those persons to whom you pass it.",Leo Tolstoy
The life of Jesus Christ is very important for us as an example of a life of one who could not see the fruits of his work during his lifetime.,Leo Tolstoy
"Every person has only one purpose: to find perfection in goodness. Therefore, only that knowledge is necessary which leads us to this.",Leo Tolstoy
"Every thought which is expressed by words is a force, and this force is limitless.",Leo Tolstoy
"Truth expressed in words is the greatest force there is in the lives of people. We do not understand this force completely, because its consequences are never seen at once.",Leo Tolstoy
"Use good thoughts of wise people; if you cannot create similar kind and wise thoughts, then at least do not distribute the false thoughts expressed by you and by others.",Leo Tolstoy
"Religious teaching, that is, the explanation of the purpose and meaning of life, should be the basis of any education.",Leo Tolstoy
"People think that it is no crime to lie to children, and that to lie to children is not really very wrong, but even sometimes necessary. But it is clear that with children you should be especially careful and honest about what you say to them.",Leo Tolstoy
"Do not say to a child whom you teach that there is a final truth, if you do not believe in something completely, or if you have some doubts. To do such a thing is a great crime.",Leo Tolstoy
Compassion for animals is so natural to us that we can become insensitive to their suffering and death only through traditions or hypnosis.,Leo Tolstoy
,Leo Tolstoy
"A person who tries to find good outside himself, either in this life or in the one to come, is making a mistake.",Leo Tolstoy
Nothing can give a man strength when he is looking for salvation other than his own effort.,Leo Tolstoy
There is nothing more attractive than humbleness and kindness. But you should not seek kindness which advertises itself.,Leo Tolstoy
"A wise man was told that he was considered to be a bad person. He answered, “It is good that they do not know everything about me, because otherwise they could say worse things about me.”",Leo Tolstoy
