Quote,Author
Real life exists only in the present. The future has no meaning.,Leo Tolstoy
"The purpose of real life is to fulfill the law of God, which exists eternally: it always existed, it exists now, and it always will exist.",Leo Tolstoy
"As soon as you go into the future or the past, you go away from God, and you feel lonely, deserted, and enslaved.",Leo Tolstoy
The future does not really exist. It is created by us in the present.,Leo Tolstoy
There is a condition in which a person feels himself the architect of his life. It occurs when he concentrates all his efforts and all his intellect on the present moment.,Leo Tolstoy
"What time could be better than childhood, and what virtues could be better than innocent joyfulness, and the need for love? They are the purest manifestations of life. You should respect every person, but you should respect a child above all, and not destroy the innocent purity of his soul.",Leo Tolstoy
The knowledge we now accept as science interferes with more than it supports the goodness of human life.,Leo Tolstoy
"Astronomy, mechanics, physics, chemistry, and all other sciences together and differently, all study the particular sides of life, but they do not come to any conclusion about the spiritual life of mankind.",Leo Tolstoy
"No matter how great our knowledge may be, it cannot help us fulfill our life’s major purpose—our moral perfection.",Leo Tolstoy
"The voice of conscience makes no mistakes. It wants, not the fulfillment of the animal self, but its denial or sacrifice.",Leo Tolstoy
"The voice of your conscience can always be singled out above the noise of your other wishes, because it always wants something seemingly useless, seemingly senseless, seemingly incomprehensible, but at the same time something actually beautiful and good, which can be achieved only through effort.",Leo Tolstoy
"The real faith attracts people to itself not because it promises goodness to those who believe, but because it is the only escape, not only from all the problems and troubles and misfortunes of our life, but also from the fear of death.",Leo Tolstoy
"If you know that you lack faith, know also that you are in one of the most dangerous situations in this world a person can be in.",Leo Tolstoy
It is bad not to have something for which you are ready to die.,Leo Tolstoy
"Look at the causes of the misfortunes from which mankind suffers. Push beyond the obvious causes to the root causes, and you will inevitably find that the most basic, the most important cause of each and every one of humanity’s problems is the weakness of faith that comes from a false attitude to the world and its origin.",Leo Tolstoy
"Salvation lies not in rituals and not in a particular creed, but in a clear understanding of the meaning of your life.",Leo Tolstoy
You cannot serve both god and the devil. Merely tending to the growth of your wealth has nothing to do with the requirements of the truly spiritual life.,Leo Tolstoy
It seems to me that the old prejudice that wealth brings happiness has begun to be discredited.,Leo Tolstoy
"Do not fear poverty, but beware wealth.",Leo Tolstoy
"If only people who seek wealth could clearly see what they would lose by having it, they would put the same amount of effort into getting rid of this wealth as they now put into acquiring it.",Leo Tolstoy
"A wise man does not wish to change his situation, because he knows that it is possible to fulfill the law of God, the law of love, in every situation.",Leo Tolstoy
"Try to establish an inner silence in yourself, a complete silence of your lips and your heart. Then you will hear how God speaks to us, and you will know how to fulfill His will.",Leo Tolstoy
"The more upset a person is with other people, and with circumstances, and the more satisfied he is with himself, the further he is from wisdom.",Leo Tolstoy
"Violence is harmful because it is usually dressed in wealth, and it therefore arouses some respect for those things which should arouse disgust.",Leo Tolstoy
"People who have power are sure that it is only violence that guides people, and so they use violence to support the existing order. But the existing order is not based on violence, but on public opinion.",Leo Tolstoy
All violence is contrary to love: do not participate in violence.,Leo Tolstoy
The biggest obstacles to understanding the truth are lies disguised as truth.,Leo Tolstoy
The exposure of a lie is as valuable to a community as a clearly expressed truth.,Leo Tolstoy
The progress of mankind is in revealing obstacles which are hiding from us.,Leo Tolstoy
Doubts do not destroy truth; they strengthen it.,Leo Tolstoy
"You will have moments in which you no longer believe in the existence of the spiritual dimension of life. Look at these moments as events in the development of your faith. A person who understands the spiritual nature of life may still at some point become afraid of death, usually for a short period of time, in the same way that you can see as you watch a scene at the theater and forget that you are watching a play, and become scared by what you are seeing as if it were real.",Leo Tolstoy
"So it is in real life: in moments of self-delusion, a religious person forgets that what happens in his physical life cannot interfere with what happens in his spiritual life.",Leo Tolstoy
"In these periods, when your spirits have fallen, you have to treat yourself as an ill man.",Leo Tolstoy
He who hesitates is not distanced from God; it is he who believes unhesitatingly in someone else’s word that God exists or does not exist who is far from God.,Leo Tolstoy
The individual ownership of large areas of land is as unjust as the ownership of other people.,Leo Tolstoy
"The injustice of owning big pieces of land as prívate property, like any other injustice, is necessarily linked with many other injustices which are used to protect it.",Leo Tolstoy
"Life’s essence lies, not in your body, but in your conscience.",Leo Tolstoy
"Let your spiritual side guide your material side, and not the other way around. In order to improve his state, a person should strive for spiritual not physical perfection.",Leo Tolstoy
Nothing can enlighten people’s lives and ease their burdens more than the understanding that they should serve God.,Leo Tolstoy
Pay goodness for evil. We should be like trees that give fruits to those who throw stones at them.,Leo Tolstoy
"You should accept yourself, not as a master, but as a servant, and then all your bad feelings, your anxiety, alarm, uncertainty, and dissatisfaction will be changed into calmness and peace. You will be filled inside with a clear vision of your purpose, and with a great joy.",Leo Tolstoy
All good things can be achieved only with effort.,Leo Tolstoy
A person cries out from pain when he takes up hard physical work after a period of idleness. Any rest from the struggle for spiritual improvement brings the same pain.,Leo Tolstoy
The most important and necessary expression of freedom is to give your thought a specific direction.,Leo Tolstoy
"Everything is in heaven’s power, except for our choice of whether to serve God or ourselves.",Leo Tolstoy
,Leo Tolstoy
Faith in the existence of eternity is our exclusively human quality.,Leo Tolstoy
Death is the destruction of the bodily organs with which I see my world during my life; the destruction of the glass through which I look at this world. The destruction of this glass does not mean the destruction of the eye itself.,Leo Tolstoy
Our understanding of eternity is the voice of God who lives within us.,Leo Tolstoy
"No matter how big mankind’s store of knowledge seems to me in comparison with our previous ignorance, it is only an infinitely small part of all possible knowledge.",Leo Tolstoy
"It is better to know less than necessary than to know more than necessary. Do not fear the lack of knowledge, but truly fear unnecessary knowledge which is acquired only to please vanity.",Leo Tolstoy
It would be possible to eat meat if it were justified by any serious considerations. But it isn’t; and meat eating is simply a bad thing that exists without any justification at all.,Leo Tolstoy
"If it were not so blindly accepted as a part of our customs and traditions, how could any sensitive person accept the thought that in order to feed ourselves we should kill such a huge number of animals, in spite of the fact that our earth gives us so many different treasures from plants?",Leo Tolstoy
"There is a big difference between, on the one hand, a person who does not have access to any food except meat, and on the other, an educated person of today who lives in a country which has vegetables and milk in abundance, and who is instructed against meat eating. The educated person sins greatly if he continues to behave in a way he knows is wrong.",Leo Tolstoy
"Work is not a virtue, but it is the necessary condition of a virtuous life.",Leo Tolstoy
"Hurried work done in irritation attracts the unfavorable attention of others. Real work is always quiet, constant, and inconspicuous.",Leo Tolstoy
"For every idle person, there is another person who works too much. For every person who eats to excess, there is another person somewhere who is hungry.",Leo Tolstoy
Much of the activity of idle people who pretend that they are busy with work is merely entertaining; it just adds a burden to other people. This can be said of all luxuriant entertainments.,Leo Tolstoy
All true wisdom and all true faith are clearly expressed in the same moral law.,Leo Tolstoy
"Moral law is so obvious and clear that even people who do not know the law have no excuse for violating it. They have only one recourse: to deny their intellect, which they do.",Leo Tolstoy
"Blaming others is an entertainment which some people like and cannot restrain themselves from. When you see all the harm this blaming causes, you see that it is a sin not to stop people from practicing this entertainment.",Leo Tolstoy
"Truth is achieved through discussion, but the wiser man stops the arguments.",Leo Tolstoy
"As soon as you start blaming a person, stop yourself. Remember not to say something bad about someone, even if you know it to be true, and especially if you are not certain but are only repeating gossip.",Leo Tolstoy
"Most people act, not according to their meditations, and not according to their feelings, but as if hypnotized, based on some senseless repetition of patterns.",Leo Tolstoy
"If, among the many voices which speak in my soul, I could only recognize my soul’s true voice, then I would never make mistakes, and never do evil. This is why it is necessary to know yourself.",Leo Tolstoy
"If you see that you are not behaving according to your inner desires, but because of some outer influence, stop and consider whether what drives you is good or bad.",Leo Tolstoy
"Worse than all the troubles and horrors of war is the perversion of minds it causes. Armies exist and the cost of war exists, and people must wrestle to find explanations for what exists. War cannot be explained with the intellect, so to justify it, people create intellectual perversions.",Leo Tolstoy
"Do not try to justify war or the existence of the military. If you try to apply logical thought to explain things that are evil, the effort will only prevent your intellect and poison your heart.",Leo Tolstoy
"The more lonely a person is, the more clearly he can hear the voice of God.",Leo Tolstoy
"The will to accomplish your good intentions depends on whether you voice them. You remember the things of which you spoke in your youth as if they were flowers that you tore out of a flower bed and threw away, and then saw lying on the earth, faded into the dirt.",Leo Tolstoy
"Temporary solitude from all things in this life, the meditation within yourself about the divine, is food as necessary for your soul as material food is for your body.",Leo Tolstoy
"A sage is not afraid of lack of knowledge: he is not afraid of hesitations, or hard work, but he is afraid of only one thing—to pretend to know the things which he does not know.",Leo Tolstoy
"Real wisdom comes, not from knowing what is good and what should be done, but from knowing which is the better thing and which is the worse, and therefore, what should be done and what should be done later.",Leo Tolstoy
"To be wise one must study both good and bad thoughts and acts, but one should study the bad first. You should first know what isnotclever, what isnotjust, and what isnotnecessary to do.",Leo Tolstoy
Religion is that which tells a person who he is and what the nature of the world in which he lives is.,Leo Tolstoy
"We should teach our children those principles that are common to all religions—Buddhist, Muslim, Christian, Jewish, and so on, that is, for the moral science of love and the unification of all people.",Leo Tolstoy
Most people do not listen to God but adore him. It is better not to adore but to listen.,Leo Tolstoy
"Moral teaching is not complete if it is not religious, but religious teaching is useless if it is not based on morality, that is, if it does not lead to a good life.",Leo Tolstoy
"Big wealth will not give you satisfaction. The more your wealth grows, the more your requirements grow with it.",Leo Tolstoy
"There are two ways not to suffer from poverty. The first is to acquire more wealth. The second is to limit your requirements. The first is not always within our power, but the second is always in our power.",Leo Tolstoy
Real love refers not just to love for a particular person but to the spiritual state of loving everyone.,Leo Tolstoy
To love means to live within the lives of those whom you love.,Leo Tolstoy
"Do not force others to love you; just love others, and you will be loved.",Leo Tolstoy
"The more a person expresses his love, the more people love him; and the more people love him, the easier it is for him to love others. In this way, love is eternal.",Leo Tolstoy
"Your spirit must constantly assert itself because your body is constantly exerting itself. As soon as you stop working at your spirit, then your body will have complete power over you.",Leo Tolstoy
"A good thing is always done with an effort, and when the effort is repeated several times, then a good thing becomes a habit.",Leo Tolstoy
"Do not detest any action which helps you to achieve good, or even more importantly—which can prevent you from doing evil.",Leo Tolstoy
Illness should be viewed as a natural condition of life.,Leo Tolstoy
"Neglecting your health can prevent you from serving people, and too much attention to your body and its health can bring the same results. In order to find the middle way, you should take care of your body only to the extent that doing so helps you to serve others, and does not stop you from serving them.",Leo Tolstoy
"No illness can prevent a person from what he has to do. If you cannot work, then give your love to people.",Leo Tolstoy
"Do not be afraid of illness, and do not think that being ill frees you from your moral requirements.",Leo Tolstoy
"You can call God by various names, you can avoid his name altogether, but you cannot avoid accepting his existence. Nothing exists here if God does not exist.",Leo Tolstoy
"All I know I know because there is God, and I know Him because He gives me the knowledge of everything.",Leo Tolstoy
"It is very important to remember God, not necessarily with words, but in the sense of being aware of Him following your actions, supporting them or criticizing them. Russian peasants have a saying: “Do you remember God?”",Leo Tolstoy
Only people who have never thought about life’s most important issues can believe that everything is possible for the human intellect.,Leo Tolstoy
"There are three types of people. First, there are people who do not believe in anything; then, there are people who believe only in those teachings they were brought up to believe. Finally, there are people who believe in those things which they understand with their hearts, and this last group of people is the wisest and most resolute.",Leo Tolstoy
Do not pretend to understand something that you do not. It is one of the worst possible things to do.,Leo Tolstoy
"A person who comes into an understanding of the life of his spiritual self cannot fear evil, either in life or in death.",Leo Tolstoy
Salvation in all things lies in their spirituality. Evil cannot touch a person who knows his spirituality.,Leo Tolstoy
"A man is both an animal and a spiritual being at the same time. As an animal, a man is afraid of death; as a spiritual being he does not experience death.",Leo Tolstoy
"In the last moments before death, the soul leaves the body. It unites with the limitless, timeless, and eternal soul and transforms into another form, we know not which. After death, our body is left behind, and it becomes only an object for observation.",Leo Tolstoy
"Death marks a change, it marks the disappearance of the dwelling place of your conscience. The conscience itself cannot be destroyed by death, in the same way as the change of a theater set cannot destroy a spectator.",Leo Tolstoy
Perhaps you fear the changes that death will bring?,Leo Tolstoy
"But a similar great change already happened at the time of your birth, and nothing bad came out of it.",Leo Tolstoy
"Most people are proud, not of those things which arouse respect, but of those which are unnecessary, or even harmful: fame, power, and wealth.",Leo Tolstoy
"There is no worse scoundrel than he who, when he looks around himself at other people, can always find an even worse scoundrel than himself; and therefore, can be quite satisfied with himself.",Leo Tolstoy
A person who loves himself has the advantage of having very few competitors.,Leo Tolstoy
There is no wisdom in he who thinks that he is wise.,Leo Tolstoy
A selfish person is always limited. And one is connected with the other: he is selfish because he is limited; he is limited because he is selfish.,Leo Tolstoy
"A proud person initially causes other people to think that he has more importance than he actually has, but when this influence disappears, as it always does, he becomes only the object of jokes.",Leo Tolstoy
"A society says to a man: “Think as we think, believe in what we believe, eat and drink what we eat and drink, and dress in the way we dress.”",Leo Tolstoy
"It is bad to irritate people by stepping back from their customs and traditions, but it is even worse to deny the requirements of your conscience and intellect by following the customs of the crowd.",Leo Tolstoy
"A state system, no matter what kind of state system it is, functions at a far remove from the requirements of Christianity.",Leo Tolstoy
"State violence cannot be destroyed by decree, only by truth and love. Maybe state violence was necessary for previous generations; maybe it is even necessary now, but people should conceive of a kind of future government in which violence will not be necessary.",Leo Tolstoy
You should live in such a way that violence is not necessary for you.,Leo Tolstoy
"People are taught to speak, but their major concern should be how to keep silent.",Leo Tolstoy
Keep silent. Give rest to your tongue more often than to your hands. You will never regret that you have kept silently but you will often regret that you spoke too much.,Leo Tolstoy
"Your chief task in life is the care of your soul You should care for your soul and work to improve it, and you can improve it only with love.",Leo Tolstoy
"The meaning of life lies in two major areas: your personal perfection and service to other people. You can serve while you are moving toward perfection, and you can move toward perfection by serving people.",Leo Tolstoy
"When I talk of moving toward perfection, I mean moving from a material to a spiritual plane, a plane of goodness, without time or death.",Leo Tolstoy
"Only one step lies between a five-year-old child and a man of my age. Between a newborn baby and a five-year-old child lies a huge distance. Between a fetus and a newborn baby lies an abyss; and between nonexistence and a fetus lies not only an abyss, but a gulf that surpasses comprehension.",Leo Tolstoy
"From childhood to death, humans, no matter their lot in life, should strive to grow to get closer and closer to the spiritual life. Strive to learn what God wants, and your life will become filled with freedom and joy.",Leo Tolstoy
"God is in all of us, and it is possible for all of us to find and understand him there.",Leo Tolstoy
To know yourself is to discover the good that lies within.,Leo Tolstoy
"If you are going through a hard time, work harder to understand God; as soon as you understand Him, all difficult things will become easy, and you will feel love and joy.",Leo Tolstoy
"If a person does not feel a divine force within himself, this does not mean that a divine force does not exist in him, but that he has not yet learned how to recognize it.",Leo Tolstoy
"If there are people and there is God, then there are relationships between God and people. These relationships are changing with time, and mankind’s religious conceptions are constantly evolving, constantly improving, becoming more clear and easily understood with the passage of time.",Leo Tolstoy
"Religious conscience of mankind is not rigid, it is changing all the time, becoming purer and clearer.",Leo Tolstoy
God is spirit and part of this spirit lives inside me and gives sense to my life.,Leo Tolstoy
"There is much good to be learned from the Koran, from the Buddhists, from Confucius, from the Old Testament, from the Indian Upanishads, and from the New Testament. But the closer a religious thinker or philosopher is to us in time, the more he can help us draw from these teachings in the light of our present-day lives.",Leo Tolstoy
The past no longer exists; the future has not yet come; there is only the present. And only in the present can the divine nature of the free human soul be manifested.,Leo Tolstoy
"If you want to do a good deed, do it now. The time will pass, and you will not have the chance again.",Leo Tolstoy
"The meaning of life is revealed to those who are ready to accept the things which will be revealed. And it is he who has already decided that he will accept the truth as it is, and not the truth itself, which will change the way of life he has been accustomed to.",Leo Tolstoy
"Who am I? What should I do? What should I believe in and what should I hope for?All of philosophy is in these questions, said the philosopher Lichtenberg. But among all these questions, the most important one is that which is in the middle. If a person knows what he should do, he will understand everything which he should know.",Leo Tolstoy
"The real meaning of life is not possible to embrace, if you are looking for the universal meaning of life. And at the same time it is so simple that it can be explained to fools and to infants when what to know is what you should do as an individual.",Leo Tolstoy
"When you approach a man, you should think not about how he can help you, but how you might serve and help him.",Leo Tolstoy
"We have the necessary law for all our actions, and this law cannot be restricted by any power. The fulfillment of this law is possible even in prison, and under the threat of tortures and death.",Leo Tolstoy
"Look for a kind life which is in harmony with the will of God, and then you will fulfill the duty of your life.",Leo Tolstoy
"In the same way as the storm troubles and muddies the waters, so too passions trouble our souls and interfere with our understanding of this life.",Leo Tolstoy
"Real power is not in momentary desires, but in complete calmness.",Leo Tolstoy
"Complete outer calmness is impossible. But when there are some calm periods, we should appreciate them and make them last longer. This is the time when useful thoughts appear; they become stronger and guide us in life.",Leo Tolstoy
Make sure that you do not gossip about your brother.,Leo Tolstoy
"Time passes, but the words which you say will remain.",Leo Tolstoy
To stop your tongue from talking too much is a sign of great virtue.,Leo Tolstoy
"If you think that it is necessary to judge your neighbor, then say this looking directly into his eyes, and say this in such a way that you do not create animosity.",Leo Tolstoy
Conscience is the understanding of the divine beginning which lives in us.,Leo Tolstoy
"You cannot fight with the requirements of conscience. These are the rules of God, and it is better to submit to them.",Leo Tolstoy
"If the foundations of our life were not of the same nature in all of us, then we would not be able to explain to each other those feelings of compassion which we really experience.",Leo Tolstoy
"There are many people who are more unhappy than you. This message cannot be a roof under which you may live, but it will be enough of a roof under which you may hide from storms.",Leo Tolstoy
"Real compassion begins only when you put yourself in the place of those who suffer, and you feel real suffering.",Leo Tolstoy
A person can understand his purpose in the same way as he understands his dignity. Only a religious person can understand his purpose in life.,Leo Tolstoy
"The freedom of a person is a great thing, and even the freedom of a whole nation begins from the freedom of a single individual.",Leo Tolstoy
"You should respect freedom in yourself, and in your neighbor, and in all people.",Leo Tolstoy
Only he who understands himself as a spiritual being can understand the spiritual dignity of other people. Such a person will not lower himself with any act which is not worthy of a spiritual person.,Leo Tolstoy
"For the moral, spiritual life, the importance of things is measured not by their material value, but by their level of goodness.",Leo Tolstoy
